Mountaineer Gigasystem (WV) Phase 1,840,United States,"Fidelis new energy, State of West Virginia, MCDA, West Virginia University, West Virginia DNR,WVGES, Babcock & Wilcox, Topsoe, Battelle Carbon Services (Storage)",Capture,2023,,2028,,Planned,1,,1.7,Hydrogen or ammonia,Dedicated storage,"CO2NNECTION Central Appalachian Basin hub/Appalachian basin storage MoU (OH, PA, WV)",North America
Mountaineer Gigasystem (WV) Phase 2,933,United States,"Fidelis new energy, State of West Virginia, MCDA, West Virginia University, West Virginia DNR,WVGES, Babcock & Wilcox, Topsoe, Battelle Carbon Services (Storage)",Capture,2023,,,,Planned,2,,1.7,Hydrogen or ammonia,Dedicated storage,"CO2NNECTION Central Appalachian Basin hub/Appalachian basin storage MoU (OH, PA, WV)",North America
Mountaineer Gigasystem (WV) Phase 3,934,United States,"Fidelis new energy, State of West Virginia, MCDA, West Virginia University, West Virginia DNR,WVGES, Babcock & Wilcox, Topsoe, Battelle Carbon Services (Storage)",Capture,2023,,,,Planned,3,,1.7,Hydrogen or ammonia,Dedicated storage,"CO2NNECTION Central Appalachian Basin hub/Appalachian basin storage MoU (OH, PA, WV)",North America
Mountaineer Gigasystem (WV) Phase 4,935,United States,"Fidelis new energy, State of West Virginia, MCDA, West Virginia University, West Virginia DNR,WVGES, Babcock & Wilcox, Topsoe, Battelle Carbon Services (Storage)",Capture,2023,,,,Planned,4,,1.7,Hydrogen or ammonia,Dedicated storage,"CO2NNECTION Central Appalachian Basin hub/Appalachian basin storage MoU (OH, PA, WV)",North America
Mt Simon Hub CCS Pipeline (IA),12,United States,"ADM, Wolf Carbon Solutions (Wolf Midstream)",Transport,2022,2024,,,Planned,,12,12,Transport,Dedicated storage,Mt Simon Hub CCS Pipeline (IA),North America
Multi-user Burrup CCUS hub and network (Karratha CCS Project),282,Australia,"Woodside, bp, Shell, Chevron, MIMI (50/50 Mitsubishi and Mitsui)",T&S,2022,,,,Planned,,,,T&S,Dedicated storage,Burrup CCUS hub,Australia and New Zealand
Mustang Station Carbon Capture (TX),283,United States,"Golden Spread Electric Cooperative,  University of Texas at Austin ",Full chain,2019,,2025,,Planned,,1.5,1.5,Power and heat,Dedicated storage,,North America
Nagoya port cluster (capture sources under evaluation),858,Japan-Indonesia,"BP, Chubu Electric",T&S,2023,,,,Planned,,,,T&S,Unknown/unspecified,Nagoya port cluster,Other Asia Pacific
Nairyah1 and Nairyah 2 plants,1016,Saudi Arabia,SPPC,Capture,2024,,,,Planned,,,2.861,Power and heat,Unknown/unspecified,,Middle East
Nanhai petrochemical plant-Capture for Daya bay CCS (Guangdong),443,People's Republic of China,Shell,Capture,2022,,,,Planned,,,,Chemicals,Dedicated storage,Daya bay CCS Hub,Other Asia Pacific
Navigator Terminal train,774,United Kingdom,"Enfinium, Navigator CO2, Bechtel (feasibility)",Transport,2023,,,,Planned,,,,Transport,Dedicated storage,Northern Endurance Partnership,Europe
Neau Lime plant,1115,France,Lhoist,Capture,2023,2027,2030,,Planned,,,1.6,Cement,Dedicated storage,GoCO2,Europe
Net Power Odessa gas plant (TX),543,United States,"Net Power, Oxy low carbon ventures (Occidental) (T&S), 8 Rivers capital (funding)",Capture,2022,,2026,,Planned,,,,Power and heat,Dedicated storage,,North America
Net Zero Teesside Power,287,United Kingdom,"BP, Equinor",Capture,2018,2024,2027,,Planned,,2,2,Power and heat,Dedicated storage,Northern Endurance Partnership,Europe
Net-zero Hydrogen Energy Complex (ALB),20,Canada,"Air Products, Baker Hughes",Capture,2021,2022,2024,,Under construction,,,,Hydrogen or ammonia,Unknown/unspecified,Alberta Carbon Trunk Line (ACTL),North America
NextDecade Rio Grande LNG (TX),288,United States,"NextDecade, Mitsubishi HI (ESA/Tech)",Capture,2021,2024,2025,,Planned,,5,5,Natural gas processing/LNG,Unknown/unspecified,BlueBonnet sequestration hub (TX),North America
Nihon Shipyard Mistubishi Shipbuilding JV LCO2 carrier,802,Japan,"Mitsubishi Shipbuilding (Mitsubishi Heavy Industries (MHI)) Group,Nihon Shipyard Co.",Transport,2023,,2027,,Planned,,,,Transport,Unknown/unspecified,,Other Asia Pacific
NL CCS Direct Injection (Noordkaap),679,Netherlands,"Eni (following acquisition of Neptune Energy), EBN, ExxonMobil, Tenaz Energy & Cape Omega",T&S,2023,2027,2030,,Planned,1,8,8,T&S,Dedicated storage,Noorkaap,Europe
Nordbex Aker feasibility study,946,Sweden,"Aker CC, Nordbex AB",Capture,2023,,,,Planned,,0.2,0.2,Power and heat,Dedicated storage,,Europe
Norske Skog Saugbrugs (Borg CO2),290,Norway,"Borg Havn, Norske Skog Saugbrugs",Capture,2019,,2035,,Planned,,0.15,0.15,Other industry,Dedicated storage,Northern Lights,Europe
North Dakota CarbonSAFE (ND),703,United States,"Summit carbon solutions, Minnkota Power Cooperative, Inc., University of North Dakota EERC (data from CarbonSafe used for project)",Storage,2017,,,,Planned,,4.99,4.99,Storage,Dedicated storage,North Dakota CarbonSAFE (ND),North America
North Drumheller Hub (ALB),505,Canada, Bison Low Carbon Ventures Inc. ,Storage,2022,,,,Planned,,3,3,Storage,Dedicated storage,North Drumheller Hub (ALB),North America
North East Alliance blue ammonia Yakutia Phase 1,291,Russia,"North East Alliance, Gas production companies in Western Yakutia
",Full chain,2021,,2026,,Planned,1,,,Hydrogen or ammonia,EOR,,Eurasia
North East Alliance blue ammonia Yakutia Phase 2,292,Russia,"North East Alliance, Gas production companies in Western Yakutia
",Full chain,2021,,2030,,Planned,2,,,Hydrogen or ammonia,EOR,,Eurasia
North Lincolnshire NLGEP,1106,United Kingdom,Solar 21 Renewable Energy Limited,Capture,2021,,,,Planned,,,,Power and heat,Dedicated storage,Northern Endurance Partnership,Europe
North Sea CO2 corridor,677,Belgium-Germany,"Wintershell dea, Fluxys, OGE",Transport,2023,,2030,,Planned,,30,30,Transport,Dedicated storage,Wintershell dea-Fluxys belgium-germany pipeline,Europe
Northern Endurance Partnership phase 1,294,United Kingdom,"BP, Equinor, TotalEnergies (partners), Worley (technical advisors), Costain (FEED transport)",T&S,2018,2024,2027,,Planned,1,4,4,T&S,Dedicated storage,Northern Endurance Partnership,Europe
Northern Endurance Partnership phase 2,452,United Kingdom,"BP, Equinor, TotalEnergies (partners), Worley (technical advisors), Costain (FEED transport)",T&S,2019,,,,Planned,2,4,4,T&S,Dedicated storage,,Europe
Northern Endurance Partnership phase 3,460,United Kingdom,"BP, Equinor, TotalEnergies (partners), Worley (technical advisors), Costain (FEED transport)",T&S,2020,,,,Planned,3,2,2,T&S,Dedicated storage,,Europe
Northern Gulf of Thailand CCS Exploration project,1000,Thailand,"PTTEP, INPEX (under cooperation between Thai Department of Mineral Fuels and JOGMEC)",Storage,2024,,,,Planned,,,,Storage,Dedicated storage,,Other Asia Pacific
Northern Lights Phase 1,295,Norway,"Shell (33.3%), TotalEnergies (33.3%), Equinor (33.3%)",T&S,2017,2020,2024,,Under construction,1,1.5,1.5,T&S,Dedicated storage,Northern Lights,Europe
Northern Lights Phase 2,296,Norway,"Shell (33.3%), TotalEnergies (33.3%), Equinor (33.3%)",T&S,2017,,2026,,Planned,2,3.7,3.7,T&S,Dedicated storage,Northern Lights,Europe
Northern Plains Nitrogen Blue ammonia (ND),297,United States,"Northern Plains Nitrogen, Summit Carbon Solutions (T&S)",Capture,2013,2024,,,Planned,,0.5,0.5,Chemicals,Dedicated storage,Midwest carbon express,North America
Northern to Western Kyushu Offshore CCS - Eneos refinery,1136,Japan,"Eneos Holdings, J-Power, JX",Full chain,2022,2026,2030,,Planned,,,,Other fuel transformation,Dedicated storage,Northern to Western Kyushu Offshore CCS,Other Asia Pacific
Northern to Western Kyushu Offshore CCS - J-Power power plant,137,Japan,J-Power,Full chain,2022,2026,2030,,Planned,,,,Power and heat,Dedicated storage,Northern to Western Kyushu Offshore CCS,Other Asia Pacific
Northern to Western Kyushu Offshore CCS (capture sources under evaluation),811,Japan,"ENEOS Corporation, JX Nippon Oil & Gas Exploration Corporation, Electric Power Development Co.,Ltd. (J-POWER)",T&S,2023,,2030,,Planned,,3,3,T&S,Dedicated storage,Northern to Western Kyushu Offshore CCS,Other Asia Pacific
Norvik Infrastructure CCS East (NICE),746,Sweden,"Ports of Stockhom,  Stockholm Exergi, Mälarenergi, Söderenergi, Vattenfall, Heidelberg Materials, Nordkalk, and Plagazi ",Transport,2023,,,,Planned,,9,9,Transport,Dedicated storage,Norvik Infrastructure CCS East (NICE),Europe
Novatek Obskiy Gas Chemical Complex Blue ammonia,298,Russia,Novatek,Full chain,2021,,2027,,Planned,,,,Hydrogen or ammonia,Dedicated storage,,Eurasia
Nucor Covent plant (LA),805,United States,"Nucor, ExxonMobil",Capture,2023,,2026,,Planned,,0.8,0.8,Iron and steel,Dedicated storage,ExxonMobil Ascension Parish storage (TX),North America
Nutrien Redwater Fertilizer (ALB) phase 1,407,Canada,Nutrien (formerly Agrium),Capture,2011,2018,2020,,Operational,1,0.3,0.3,Chemicals,EOR,Alberta Carbon Trunk Line (ACTL)/Enhance Clive Sequestration Facility (ALB),North America
Nutrien Redwater Fertilizer (ALB) phase 2,608,Canada,Nutrien (formerly Agrium),Capture,2022,,,,Planned,2,,,Chemicals,EOR,Alberta Carbon Trunk Line (ACTL),North America
NWR Sturgeon Refinery (ALB),293,Canada,Northwest Redwater Partnership,Capture,2011,2014,2020,,Operational,,1.3,1.3,Other fuel transformation,EOR,Alberta Carbon Trunk Line (ACTL)/Enhance Clive Sequestration Facility (ALB),North America
OCAP,1096,Netherlands,OCAP (Linde),Transport,,,2005,,Operational,,0.5,0.5,Transport,Use,,Europe
Oceania CCS (capture sources under evaluation),647,Japan-unknown,"Nippon steel, ExxonMobil, Mitsubishi",T&S,2023,,,,Planned,,2,2,T&S,Dedicated storage,Oceania CCS,Other Asia Pacific - Australia and New Zealand
OCI Fertilizer plant phase 1 (IA),521,United States,"OCI, Enerflex (CO2 capture), Blackrock (funding), Navigor (T)",Capture,2021,2022,2025,,Under construction,1,0.45,0.45,Chemicals,Dedicated storage,Heartland Greenway,North America
OCI Fertilizer plant phase 2 (IA),522,United States,"OCI, Enerflex (CO2 capture), Blackrock (funding), Navigor (T)",Capture,2021,,,,Planned,2,0.25,0.25,Chemicals,Dedicated storage,Heartland Greenway,North America
Offshore Malay CCS (capture sources under evaluation),812,Japan-Malaysia,"Mitsui, TotalEnergies, PETRONAS",T&S,2023,,2030,,Planned,,2,2,T&S,Dedicated storage,Offshore Malay CCS,Other Asia Pacific
Olso Celsio,302,Norway,"Hafslund Oslo Celsio (formerly Fortum Oslo Varme), Aker CC (FEED)",Capture,2016,,2025,2025,Planned,,0.4,0.4,Power and heat,Dedicated storage,Northern Lights,Europe
OLYMPUS Holcim Milaki,657,Greece,"Holcim Group, Air Liquide",Capture,2023,,2028,,Planned,,1,1,Cement,Dedicated storage,Prinos CO2 storage,Europe
Omifco ammonia capture,618,Oman,"OQ group, Omifco",Capture,2023,,,,Planned,,,2.118,Hydrogen or ammonia,Unknown/unspecified,,Middle East
One Earth Energy ethanol CCS (IL),299,United States,One Earth Energy,Capture,2020,2024,2025,,Planned,,0.45,0.45,Biofuels,Dedicated storage,CarbonSAFE Illinois Storage Corridor (IL),North America
Opal Carbon Hub (ALB),507,Canada, Kiwetinohk Energy Corp.,Storage,2022,,,,Planned,,,,Storage,Dedicated storage,Opal Carbon Hub (ALB),North America
Open Access Wabamun Carbon Hub (ALB),300,Canada,"Enbridge, Capital Power, Heidelberg Materials, First Nation Capital Investment Partnership (FNCIP)",Storage,2022,,,,Planned,,4,4,Storage,Dedicated storage,Open Access Wabamun Carbon Hub (ALB),North America
Orchard (TX),877,United States,"Orchard Storage Company LLC, Elysian Ventures LLC, EnCap Flatrock Midstream, Buckeye Partners, Lonquist Sequestration",Storage,2022,,,,Planned,,1,1,Storage,Unknown/unspecified,,North America
Origins project (ALB),301,Canada,Enhance Energy,T&S,2022,,,,Planned,,20,20,T&S,Dedicated storage,Origins project (ALB),North America
Orion (AL),865,United States,ExxonMobil (formerly Denbury carbon solutions),Storage,2022,,2026,,Planned,,10 - 20,20,Storage,Dedicated storage,,North America
Orion CCS Project Phase 1,850,United Kingdom,"Prenco UK (licencee 80%), Carbon Catalyst Ltd (10%), Summit Energy Evolution Limited (Sumitomo) (10%)",Storage,2023,2029,2031,,Planned,1,1,1,Storage,Dedicated storage,,Europe
Orion CCS Project Phase 2,851,United Kingdom,"Prenco UK (licencee 80%), Carbon Catalyst Ltd (10%), Summit Energy Evolution Limited (Sumitomo) (10%)",Storage,2023,2029,,,Planned,2,5,5,Storage,Dedicated storage,,Europe
Orlen Lietuva,1143,Lithuania,Orlen Lietuva,Capture,2022,,2030,,Planned,,0.3,0.3,Other fuel transformation,Dedicated storage,"CCS Baltic Consortium, Klapeida terminal",Europe
Osage CCS 1 (OK),889,United States,CapturePoint LLC,Storage,2022,,,,Planned,,,,Storage,Unknown/unspecified,Osage CCS 1 (OK),North America
Oxy DAC potential expansion scenario global 2030,466,Unknown,"1PointFive, Oxy low carbon ventures (Occidental)",Full chain,2022,,2030,,Planned,1,,38.2,DAC,Dedicated storage,,Unknown
Oxy DAC potential expansion scenario US 2030,475,United States,"1PointFive, Oxy low carbon ventures (Occidental)",Full chain,2022,,2030,,Planned,2,,16.3,DAC,Dedicated storage,South Texas DAC Hub,North America
Oxy/ADNOC UAE DAC,921,United Arab Emirates,"Oxy low carbon ventures (Occidental), ADNOC",Capture,2023,,,,Planned,,1,1,DAC,Dedicated storage,,Middle East
Pannonia Bio refinery,745,Hungary,ClonBio Group,Full chain,2021,,2026,,Planned,,0.5,0.5,Biofuels,Dedicated storage,,Europe
Papua LNG CCS,548,Papua New Guinea,TotalEnergies,Full chain,2018,2024,2027,,Planned,,1,1,Natural gas processing/LNG,Dedicated storage,,Other Asia Pacific
Parc Adfer CCS ,905,United Kingdom,Enfinium,Capture,2023,,,,Planned,,0.1,0.1,Power and heat,Dedicated storage,,Europe
Pathways alliance (ALB) (14 facilities),722,Canada,"Pathways Alliance (CNRL, Cenovus Energy, ConocoPhilips, Imperial, MEG Energy, and Suncor)",Capture,2022,,2030,,Planned,,10 - 12,12,Other fuel transformation,Dedicated storage,Oil Sands Pathways to Net Zero T&S (ALB),North America
Pathways Alliance (T&S) (ALB),506,Canada,"Pathways Alliance (CNRL, Cenovus Energy, ConocoPhilips, Imperial, MEG Energy, and Suncor)",T&S,2022,,2030,,Planned,,10 - 12,12,T&S,Dedicated storage,Pathways Alliance (T&S) (ALB),North America
PCS Nitrogen Geismar Ammonia plant (LA),304,United States,"Nutrien, ExxonMobil (formerly Denbury carbon solutions)",Capture,2022,2024,2027,,Planned,,1.2 - 1.8,1.8,Hydrogen or ammonia,Dedicated storage,Denbury Green pipeline /Gemini (LA),North America
PCS Nitrogen-Geismar plant (LA),305,United States,"Nutrien, ExxonMobil (formerly Denbury carbon solutions)",Full chain,2011,2011,2013,,Operational,,0.2 - 0.3,0.3,Chemicals,EOR,,North America
Peak cluster transport,768,United Kingdom,"Progressive Energy, Breedon group",Transport,2023,,2030,,Planned,,3,3,Transport,Dedicated storage,Peak cluster transport/Morecambe Net Zero Cluster,Europe
Pecos County Ultra Clean Fuels Refining (TX),451,United States,MMEX,Capture,2021,,,,Planned,,,,Other fuel transformation,EOR,,North America
Pegasus (LA),883,United States,ExxonMobil (formerly Denbury carbon solutions),Storage,2022,,2027,,Planned,,10 - 20,10,Storage,Unknown/unspecified,,North America
Pelican Rindge Tract CCS Project (CA),900,United States,Pelican Renewables LLC ,Full Chain,2023,,,,Planned,,2,2,Biofuels,Dedicated storage,,North America
Pelican sequestration hub (Livingston Parish) (LA),815,United States,"Pelican Sequestration Hub LLC (Oxy low carbon ventures, Occidental), and Rusheen Capital",Storage,2022,,2025,,Planned,,6,6,Storage,Dedicated storage,EnLink midstream network/ Pelican sequestration hub,North America
Pembina low carbon complex,791,Canada,"Pembina Pipeline Corporation, Marubeni",Capture,2023,,2027,,Planned,,,,Hydrogen or ammonia,Dedicated storage,Alberta Carbon Grid (ALB),North America
Pembroke Net Zero Centre (PNZC),515,United Kingdom,RWE,Capture,2022,2024,2040,,Planned,,5.149,5.149,Power and heat,Dedicated storage,,Europe
Permian Regional Carbon Sequestration Hub (TX),1084,United States,Omnia midstream partners,T&S,2023,,,,Planned,,2,2,T&S,Unknown/unspecified,Permian Regional Carbon Sequestration Hub (TX),North America
Peterhead Carbon Capture Power Station,307,United Kingdom,"SSE Thermal, Equinor",Capture,2021,2024,2030,,Planned,,1.5,1.5,Power and heat,Dedicated storage,Acorn CCS,Europe
Petra Nova Carbon Capture (TX),309,United States,"Equity: NRG and JX Nippon, Debt: JBIC & Mizhou bank (backed by NEXI)",Full chain,2009,2014,2023,2023,Operational,,1.4,1.4,Power and heat,EOR,,North America
Petrobras Santos Basin pre-salt oilfield CCS,310,Brazil,Petrobas,Full chain,2011,,2013,,Operational,,3 - 10.6,10.6,Natural gas processing/LNG,EOR,,Central and South America
Petronas Kasawari gas field CCS project (Kasawari Phase 2 project),311,Malaysia,"Petronas, Technip, National Petroleum Construction Company, Worley (EPC), Kawasaki Heavy Industries, Malaysia Marine and Heavy Engineering Sdn Bhd (Compressor)",Full chain,2020,2022,2025,,Under construction,,3.3,3.3,Natural gas processing/LNG,Dedicated storage,,Other Asia Pacific
Phillips 66 Humber refinery,312,United Kingdom,"Phillips 66, Babcock & Wilcox (FEED)",Capture,2021,,2028,,Planned,,4,4,Other fuel transformation,Dedicated storage,Viking CCS,Europe
Phoenix project (TX),982,United States,Projeo Corporation,Storage,2023,,,,Planned,,,,Storage,Dedicated storage,Phoenix project (TX),North America
Pieridae Caroline Carbon Capture Power Complex Phase 1 (ALB),313,Canada,Pieridae Energy Ltd.,Full chain,2021,,,,Planned,1,1,1,Power and heat,Dedicated storage,,North America
Pieridae Caroline Carbon Capture Power Complex Phase 2 (ALB),314,Canada,Pieridae Energy Ltd.,Full chain,2021,,,,Planned,2,2,2,Power and heat,Dedicated storage,,North America
Pincher Creek Carbon Sequestration Hub (ALB),508,Canada, West Lake Energy Corp.,Storage,2022,,,,Planned,,2.7,2.7,Storage,Dedicated storage,Pincher Creek Carbon Sequestration Hub (ALB),North America
Pine Lake Corn Processors Steamboat Rock biorefinery (IA),315,United States,"Pine Lake Corn Processors, Summit Carbon Solutions",Capture,2021,2024,2024,,Planned,,0.19 - 0.23,0.229,Biofuels,Dedicated storage,Midwest carbon express,North America
Pineywoods CCS hub (TX),1049,United States,Pineywoods CCS hub LLC (Tenaska),Storage,2023,,,,Planned,,,,Storage,Dedicated storage,Pineywoods CCS hub (TX),North America
Plant Daniel Carbon Capture (MS) ,316,United States,"Southern Company Services, Linde/BASF (FEED, tech provider)",Capture,2019,,2025,,Planned,,1.8,1.8,Power and heat,Dedicated storage,Project ECO2S: Early CO2 Storage Complex in Kemper County (MS),North America
Plock plant,1034,Poland,PKN Orlen,Capture,2023,,2027,,Planned,,1,1,Chemicals,Dedicated storage,ECO2CEE,Europe
Plymouth Energy Merrill biorefinery (IA),317,United States,"Plymouth Energy, Summit Carbon Solutions",Capture,2021,2024,2024,,Planned,,0.13 - 0.16,0.157,Biofuels,Dedicated storage,Midwest carbon express,North America
"POET 17 bioprocessing plants (IA, NE, SD)",318,United States,POET,Capture,2021,,2025,,Planned,,5,5,Biofuels,Dedicated storage,Midwest carbon express,North America
Polaris offshore storage facility,322,Norway,"Horisont Energi, PGNiG Upstream Norway (operator)",Storage,2021,2024,2028,,Planned,,4 - 8,8,Storage,Dedicated storage,Polaris offshore storage facility,Europe
Polk county hub (TX),1021,United States,"1PointFive (Occidental Low carbon Venture), Natural Resource Partners",Storage,2022,,,,Planned,,,,Storage,Dedicated storage,Polk county hub (TX),North America
Polk Power station NGCC/Polk carbon storage complex (FL),552,United States,"Tampa Electric Company, ION Clean Energy, DOE Office of Clean Energy Demonstrations (FEED funding)",Full chain,2022,,,,Planned,,3,3,Power and heat,Dedicated storage,,North America
Port of Aalborg terminal and pipeline to Fyrkat (Norne carbon storage hub),672,Denmark,"Fidelis new energy, Gas Storage Denmark, Capio Danmark (PCI coordinator), KBR (FEED)",Transport,2022,,2026,,Planned,,4,4,Transport,Dedicated storage,Norne carbon storage hub,Europe
Port of Corpus Christi-Mississippi pipeline (TX),799,United States,Howard Midstream Energy Partners LLC,Transport,2023,,,,Planned,,250,250,Transport,Unknown/unspecified,Port of Corpus Christi-Mississippi pipeline,North America
Port of Kalundborg terminal and pipeline to Trelleborg phase 1 (Norne carbon storage hub),673,Denmark,"Fidelis new energy, Gas Storage Denmark, Capio Danmark (PCI coordinator)",Transport,2022,,2026,,Planned,1,4,4,Transport,Dedicated storage,Norne carbon storage hub,Europe
Port of Kalundborg terminal and pipeline to Trelleborg phase 2 (Norne carbon storage hub),674,Denmark,"Fidelis new energy, Gas Storage Denmark, Capio Danmark (PCI coordinator)",Transport,2022,,2030,,Planned,2,8,8,Transport,Dedicated storage,Norne carbon storage hub,Europe
Porthos offshore transport and storage,325,Netherlands,"Energie Beheer Nederland (EBN), Gasunie, and the Port of Rotterdam",T&S,2018,2023,2026,,Under construction,1,2.5,2.5,T&S,Dedicated storage,Porthos,Europe
Porthos onshore transport,249,Netherlands,"Energie Beheer Nederland (EBN), Gasunie, and the Port of Rotterdam",Transport,2018,2023,2026,,Under construction,1,10,10,Transport,Dedicated storage,Porthos,Europe
Poseidon CO2 storage,775,Norway,"Aker BP (60%), OMV AS (4%)",Storage,2023,2025,,,Planned,,5,5,Storage,Dedicated storage,Poseidon CO2 storage,Europe
Prairie State Generating Station Carbon Capture (IL),327,United States,"Prairie Research Institute (University of Illinois), Mitsubishi Heavy Industries, Kiewit Engineering Group, Sargent & Lundy",Capture,2019,,2025,,Planned,,5 - 7.5,6.05,Power and heat,Dedicated storage,CarbonSAFE Illinois Storage Corridor (IL),North America
Prax Lindsey Oil Refinery Phase 1,328,United Kingdom,Prax,Capture,2021,,2027,,Planned,1,0.55,0.55,Other fuel transformation,Dedicated storage,Viking CCS,Europe
Prax Lindsey Oil Refinery Phase 2,329,United Kingdom,Prax,Capture,2021,,2029,,Planned,2,0.55,0.55,Other fuel transformation,Dedicated storage,Viking CCS,Europe
Preem CCS at Lysekil refinery,330,Sweden,"Preem, Aker solutions, Equinor",Capture,2018,,2025,,Planned,,0.5,0.5,Other fuel transformation,Dedicated storage,Northern Lights,Europe
Prinos CCS phase 1,688,Greece,Energean,T&S,2021,,2025,,Planned,1,1,1,T&S,Dedicated storage,Prinos CO2 storage,Europe
Prinos CCS phase 2,689,Greece,Energean,T&S,2021,,2027,,Planned,2,2.5,2.5,T&S,Dedicated storage,Prinos CO2 storage,Europe
Prinos sigma plant,690,Greece,Energean,Capture,2022,,2025,,Planned,,1,1,Natural gas processing/LNG,Dedicated storage,Prinos CO2 storage,Europe
Project Air Perstorp Oxo capture,563,Sweden,"Perstorp Oxo AB (capture and methanol), FORTUM SVERIGE AB (hydrogen), Sydkraft AB, Uniper, Sunfire (electrolyser), Johnson Matthey (methanol synthesis, FEED)",CCU,2020,,2027,,Planned,,0.406,0.406,Chemicals,Use,,Europe
Project Bifrost Phase 1,331,Denmark," Danish Underground Consortium (TotalEnergies, Noreco, Nordsofonden), Orsted, TU Denmark",T&S,2021,,2030,,Planned,1,2 - 3,3,T&S,Dedicated storage,Project Bifrost,Europe
Project Bison (WY) Phase 1,470,United States,"CarbonCapture, Frontier Carbon Solutions",Capture,2022,,2024,,Planned,1,0.01,0.01,DAC,Dedicated storage,Sweetwater Carbon Storage Hub (WY),North America
Project Bison (WY) Phase 2,471,United States,"CarbonCapture, Frontier Carbon Solutions",Capture,2022,,2026,,Planned,2,0.2,0.2,DAC,Dedicated storage,Sweetwater Carbon Storage Hub (WY),North America
Project Bison (WY) Phase 3,472,United States,"CarbonCapture, Frontier Carbon Solutions",Capture,2022,,2028,,Planned,3,0.8,0.8,DAC,Dedicated storage,Sweetwater Carbon Storage Hub (WY),North America
Project Bison (WY) Phase 4,473,United States,"CarbonCapture, Frontier Carbon Solutions",Capture,2022,,2028,,Planned,4,4,4,DAC,Dedicated storage,Sweetwater Carbon Storage Hub (WY),North America
Project Blue (AR),257,United States,"Lapis Energy, LSB",Full chain,2022,,2025,,Planned,,0.45,0.45,Hydrogen or ammonia,Dedicated storage,,North America
Project Cavendish Phase 1,332,United Kingdom,"Arup, VPI, National Grid Ventures, Shell, SSE Thermal, Uniper, Acorn
",Capture,2021,2024,2026,,Planned,1,1.2,1.2,Hydrogen or ammonia,Dedicated storage,Acorn CCS,Europe
Project Cavendish Phase 2,333,United Kingdom,"Arup, VPI, National Grid Ventures, Shell, SSE Thermal, Uniper, Acorn
",Capture,2021,2024,2026,,Planned,2,1.8,1.8,Hydrogen or ammonia,Dedicated storage,Acorn CCS,Europe
Project Clear Horizon - natural gas fired power plants (ALB),509,Canada, City of Medicine Hat,Capture,2022,,,,Planned,,,,Power and heat,Dedicated storage,Project Clear Horizon (ALB),North America
Project Clear Horizon (ALB),1126,Canada,City of Medicine Hat,T&S,2022,,,,Planned,,3,3,T&S,Dedicated storage,Project Clear Horizon (ALB),North America
"Project Crossroads (IN, IL, MI)",979,United States,BP Carbon Solutions LLC,T&S,2023,,,,Planned,,23,23,T&S,Dedicated storage,"Project Crossroads (IN, IL, MI)",North America
Project Greensand phase 1,335,Denmark,"INEOS E&P, Wintershell Dea, Welltec (storage), Aquaterra Energy (FEED)",T&S,2020,2024,2026,,Planned,1,1.5,1.5,T&S,Dedicated storage,Project Greensand,Europe
Project Greensand phase 2,336,Denmark,"INEOS E&P, Wintershell Dea, Welltec (storage)",T&S,2020,,2030,,Planned,2,6.5,6.5,T&S,Dedicated storage,Project Greensand,Europe
Project Hajar,537,Oman,"Mission Zero, 44.01",Full chain,2022,,2024,,Under construction,,0.001,0.001,DAC,Dedicated storage,,Middle East
Project Hummingbird,1077,Kenya,Octavia carbon,Full chain,,,2025,,Planned,1,0.001,0.001,DAC,Dedicated storage,,Africa
Project Interseqt - Hereford Ethanol Plant (TX),337,United States,"White Energy, Oxy low carbon ventures (Occidental)",Full chain,2018,,2024,,Planned,,0.35,0.35,Biofuels,EOR,,North America
Project Interseqt - Plainview Ethanol Plant (TX),338,United States,"White Energy, Oxy low carbon ventures (Occidental)",Full chain,2018,,2024,,Planned,,0.35,0.35,Biofuels,EOR,,North America
